{
  "$schema": "http://json-schema.org/draft-04/schema#",
  "title": "Opening",
  "type": "object",
  "properties": {
    "id": {
      "type": "string"
    },
    "servicePointId": {
      "type": "string"
    },
    "name": {
      "type": "string"
    },
    "startDate": {
      "type": "string",
      "format": "date-time"
    },
    "endDate": {
      "type": "string",
      "format": "date-time"
    },
    "openingDays": {
      "type": "array",
      "items": {
        "type": "object",
        "$ref": "OpeningDayIncludeWeekdays.json"
      }
    },
    "creationDate": {
      "type": "string",
      "format": "date-time"
    },
    "createdBy": {
      "type": "string"
    }
  },
  "additionalProperties": false,
  "required": [
    "startDate"
  ]
}
