{
  "id": "na9927e8-5f79-498e-94ea-8b5b474795c8",
  "servicePointId": "1",
  "name": "exceptional_4",
  "startDate": "2019-01-22",
  "endDate": "2019-01-22",
  "openingDays": [{
    "openingDay": {
      "openingHour": [
        {
          "startTime": "12:00",
          "endTime": "13:00"
        }
      ],
      "allDay": false,
      "open": true
    }
  }]
}
