{
  "id": "ha9927e8-5f79-498e-94ea-8b5b474795c8",
  "servicePointId": "1",
  "name": "opening_4",
  "startDate": "2019-01-21",
  "endDate": "2019-02-30",
  "openingDays": [{
    "weekdays": {
      "day": "MONDAY"
    },
    "openingDay": {
      "openingHour": [
        {
          "startTime": "10:00",
          "endTime": "12:00"
        },{
          "startTime": "14:00",
          "endTime": "17:00"
        }
      ],
      "allDay": false,
      "open": true
    }
  }]
}
