{
  "id": "ga9927e8-5f79-498e-94ea-8b5b474795c8",
  "servicePointId": "1",
  "name": "opening_3",
  "startDate": "2018-12-11",
  "endDate": "2018-12-22",
  "openingDays": [{
    "weekdays": {
      "day": "FRIDAY"
    },
    "openingDay": {
      "openingHour": [],
      "allDay": true,
      "open": true
    }
  }]
}
