{
  "id": "fa9927e8-5f79-498e-94ea-8b5b474795c8",
  "servicePointId": "1",
  "name": "opening_2",
  "startDate": "2018-10-21",
  "endDate": "2018-11-30",
  "openingDays": [{
    "weekdays": {
      "day": "WEDNESDAY"
    },
    "openingDay": {
      "openingHour": [
        {
          "startTime": "10:00",
          "endTime": "12:00"
        }
      ],
      "allDay": false,
      "open": true
    }
  }]
}
